{
 "id": "length-of-stay",
 "names": {
  "name": "Length of stay",
  "aliases": [
   "LOS",
   "ward nights",
   "inpatient days",
   "bed days"
  ],
  "said": "Hospitals abroad quote nights. Statisticians count days. A package that says three nights is describing a plan, not a measurement."
 },
 "etymology": {
  "root": "A compound of two plain words doing accounting work. Stay as a noun is 1520s, \"continuance in a place; stationary position\", from the verb, mid-15c., from Old French estai-, stem of estare, to stay or stand, from Latin stare, to stand or remain standing. Length is the quality of being long. Nothing in the phrase is medical; it names a duration somebody is paying for.",
  "first_attested": "1520s for the noun stay",
  "tier": "cited",
  "source": "s:etymonline-stay",
  "note": "Nights and days are not the same count. A stay admitted on Monday and discharged on Wednesday is two nights, and three hospital days under most statistical conventions."
 },
 "text": {
  "what": "How long a patient occupies a hospital bed. On a price page it is a number of nights the seller has budgeted for; in a health statistic it is a measured average across discharges. The first is a forecast and the second is a result, and the word does not distinguish them.",
  "story": "On a package the number is a boundary. Bumrungrad's knee package names three nights in the surgical ward and excludes \"nights beyond 3, and any ICU\"; its hip package names four. Both figures are what the hospital has priced, not what a given knee will need. A fourth night is not a complication in the clinical sense and is still a bill.\n\n*Trade practice —* the trade quotes the stay twice over and means different things each time: nights in the ward, and then days in the country before the surgeon will sign a fitness-to-fly note. The second number is longer than the first, and it is the one that sets the hotel bill, the companion's leave and the changeable fare.\n\n*Inference —* a short published stay is also a selling point, which gives the number a direction. Nothing on a package page is audited against what the ward actually recorded.",
  "how": "Three questions make a stay figure readable: whether the quoted number is nights or days; what a night past the package costs and whether that rate is published; and whether intensive care sits inside the count or outside it, which it usually does.",
  "today": "As of 17 September 2026 the stay figures on this site's procedure records are read off sellers' package pages and are labelled as such. Comparable national averages exist in OECD Health Statistics, which measures discharges rather than packages, and the two cannot be substituted for one another."
 },
 "kin": [
  {
   "to": "in-hospital",
   "as": "The step this number is the length of.",
   "rel": "step"
  },
  {
   "to": "day-case",
   "as": "The stay of zero nights, and the category a package can quietly leave.",
   "rel": "contrast"
  },
  {
   "to": "package-price",
   "as": "Where the nights are fixed, and where the night after them is priced.",
   "rel": "term"
  },
  {
   "to": "drg",
   "as": "The payment unit that made short stays profitable and long ones a loss.",
   "rel": "term"
  },
  {
   "to": "knee-replacement",
   "as": "The operation whose three-night package this record reads.",
   "rel": "procedure"
  },
  {
   "to": "flying-after-surgery",
   "as": "The second, longer stay: days in the country before a seat is allowed.",
   "rel": "risk"
  }
 ],
 "sources": [
  "s:etymonline-stay",
  "s:bumrungrad-joint04",
  "s:bumrungrad-joint08",
  "s:oecd-health-statistics"
 ],
 "provenance": {
  "default": {
   "tier": "cited"
  },
  "fields": {
   "text.story": {
    "tier": "cited",
    "note": "the package figures are cited; the marked stretches are the trade's account and this project's reasoning"
   },
   "text.how": {
    "tier": "inference"
   }
  }
 },
 "confidence": "medium",
 "needs_verification": true,
 "schema": 1,
 "type": "term",
 "region": [
  "global"
 ],
 "updated": "2026-09-17",
 "facets": {
  "letter": "L"
 }
}
